{
  "$schema": "./tools.schema.json",
  "schemaVersion": 1,
  "project": {
    "name": "REST Atlas",
    "repository": "https://github.com/Rentgen-io/rest-atlas",
    "branch": "main"
  },
  "categories": [
    {
      "id": "clients",
      "name": "API clients",
      "description": "Compose requests, inspect responses, and explore endpoints.",
      "color": "#668c68",
      "icon": "terminal",
      "shortLabel": "EXPLORE & DEBUG"
    },
    {
      "id": "functional",
      "name": "Functional testing",
      "description": "Validate REST behavior and maintain repeatable regression checks.",
      "color": "#568d8d",
      "icon": "check-circle",
      "shortLabel": "ASSERT & AUTOMATE"
    },
    {
      "id": "generation",
      "name": "Test generation",
      "description": "Generate test inputs and explore behavior with automated mutations or fuzzing.",
      "color": "#9280b8",
      "icon": "sparkles",
      "shortLabel": "DISCOVER & GENERATE"
    },
    {
      "id": "contract",
      "name": "Contract & schema",
      "description": "Check consumer-provider agreements and OpenAPI response conformance.",
      "color": "#788fbd",
      "icon": "file",
      "shortLabel": "DEFINE & VALIDATE"
    },
    {
      "id": "security",
      "name": "Security testing",
      "description": "Assess authentication behavior, API vulnerabilities, and security controls.",
      "color": "#b88378",
      "icon": "shield",
      "shortLabel": "PROBE & PROTECT"
    },
    {
      "id": "performance",
      "name": "Performance",
      "description": "Measure REST API response behavior, throughput, and load.",
      "color": "#b69b59",
      "icon": "activity",
      "shortLabel": "LOAD & MEASURE"
    },
    {
      "id": "mocking",
      "name": "Mocking",
      "description": "Simulate HTTP services and isolate dependencies during testing.",
      "color": "#b48baf",
      "icon": "layers",
      "shortLabel": "SIMULATE & ISOLATE"
    },
    {
      "id": "monitoring",
      "name": "Monitoring",
      "description": "Run scheduled REST API checks and alert on failures.",
      "color": "#6c9c88",
      "icon": "monitor",
      "shortLabel": "OBSERVE & ALERT"
    },
    {
      "id": "recording",
      "name": "Traffic recording & replay",
      "description": "Capture HTTP traffic and replay it as repeatable regression tests or service mocks.",
      "color": "#a88863",
      "icon": "git-branch",
      "shortLabel": "RECORD & REPLAY"
    }
  ],
  "tools": [
    {
      "id": "advanced-rest-client",
      "name": "Advanced REST Client",
      "description": "A desktop HTTP client for composing REST requests, inspecting responses, and organizing reusable API requests.",
      "website": "https://github.com/advanced-rest-client/arc-electron",
      "categories": ["clients"],
      "licenseModel": "open-source",
      "license": "Apache-2.0",
      "pricing": "free",
      "interfaces": ["desktop"],
      "execution": ["local"],
      "testCreation": ["manual"],
      "ci": null,
      "features": [
        "HTTP request composition",
        "Response inspection",
        "Reusable request history"
      ],
      "notes": "This entry covers the ARC Electron desktop application. Current maintenance status and a dedicated CI runner have not been confirmed.",
      "status": "unknown",
      "sources": [
        "https://github.com/advanced-rest-client/arc-electron",
        "https://github.com/advanced-rest-client/arc-electron/blob/master/LICENSE.md"
      ],
      "repository": "https://github.com/advanced-rest-client/arc-electron",
      "lastVerified": "2026-10-27"
    },
    {
      "id": "apidog",
      "name": "Apidog",
      "description": "Design and explore REST APIs, validate responses against schemas, build automated test scenarios, and simulate services with mocks.",
      "website": "https://apidog.com/",
      "categories": [
        "clients",
        "functional",
        "contract",
        "mocking",
        "generation"
      ],
      "licenseModel": "proprietary",
      "license": "Proprietary",
      "pricing": "freemium",
      "interfaces": ["desktop", "web", "cli"],
      "execution": ["local", "cloud", "self-hosted"],
      "testCreation": ["manual", "scripted", "generated"],
      "ci": true,
      "features": [
        "OpenAPI-based API design and response validation",
        "Chained test scenarios and data-driven runs",
        "Mock servers and CLI execution"
      ],
      "notes": "Free and paid plans are available. Hosted, local, and on-premises capabilities depend on the selected edition and execution mode.",
      "status": "active",
      "sources": [
        "https://apidog.com/",
        "https://apidog.com/pricing/",
        "https://apidog.com/blog/apidog-cli-test-rest-api-command-line/",
        "https://apidog.com/blog/canary-testing-apis/",
        "https://apidog.com/blog/apidog-cli-vs-keploy/"
      ],
      "lastVerified": "2026-10-27"
    },
    {
      "id": "bowire",
      "name": "Bowire",
      "description": "A multi-protocol API workbench with REST discovery, request assertions, traffic recording and replay, mocks, and command-line automation.",
      "website": "https://bowire.io/",
      "categories": [
        "clients",
        "functional",
        "mocking",
        "recording",
        "security",
        "performance"
      ],
      "licenseModel": "open-source",
      "license": "Apache-2.0",
      "pricing": "free",
      "interfaces": ["web", "cli", "ide", "library"],
      "execution": ["local", "self-hosted"],
      "testCreation": ["manual", "scripted", "recorded"],
      "ci": true,
      "features": [
        "REST endpoint discovery from OpenAPI",
        "Response assertions and CLI execution",
        "Recorded sessions, replay mocks, security scans, and latency measurements"
      ],
      "notes": "Runs standalone or embedded in an ASP.NET application. Protocols use plugins; this entry describes its REST capabilities.",
      "status": "active",
      "sources": [
        "https://bowire.io/",
        "https://github.com/Kuestenlogik/Bowire"
      ],
      "repository": "https://github.com/Kuestenlogik/Bowire",
      "lastVerified": "2026-10-27"
    },
    {
      "id": "bruno",
      "name": "Bruno",
      "description": "A local, Git-friendly API client with file-based collections, scripted assertions, and a CLI runner.",
      "website": "https://www.usebruno.com/",
      "categories": ["clients", "functional"],
      "licenseModel": "open-source",
      "license": "MIT (open-source core)",
      "pricing": "freemium",
      "interfaces": ["desktop", "cli"],
      "execution": ["local"],
      "testCreation": ["manual", "scripted"],
      "ci": true,
      "features": [
        "File-based request collections",
        "Assertions and test scripts",
        "CLI collection execution"
      ],
      "notes": "Paid editions add features. The open-source license describes the core, not every commercial component.",
      "status": "active",
      "sources": [
        "https://www.usebruno.com/",
        "https://www.usebruno.com/pricing"
      ],
      "lastVerified": "2026-10-27",
      "repository": "https://github.com/usebruno/bruno"
    },
    {
      "id": "chapar",
      "name": "Chapar",
      "description": "A local desktop REST client with file-based collections, Python scripts, chained test cases, and a CLI for repeatable API checks.",
      "website": "https://chapar.rest/",
      "categories": ["clients", "functional"],
      "licenseModel": "open-source",
      "license": "BSD-3-Clause",
      "pricing": "free",
      "interfaces": ["desktop", "cli"],
      "execution": ["local"],
      "testCreation": ["manual", "scripted"],
      "ci": true,
      "features": [
        "Git-friendly YAML request collections",
        "Python pre-request and response test scripts",
        "Chained test cases and chapar-cli execution"
      ],
      "notes": "Also supports other API protocols. Collections and environments are stored locally.",
      "status": "active",
      "sources": [
        "https://chapar.rest/",
        "https://github.com/chapar-rest/chapar/blob/main/LICENSE"
      ],
      "repository": "https://github.com/chapar-rest/chapar",
      "lastVerified": "2026-10-27"
    },
    {
      "id": "checkly",
      "name": "Checkly",
      "description": "Define REST API checks, run them on a schedule, and investigate failures with monitoring and alerting.",
      "website": "https://www.checklyhq.com/",
      "categories": ["monitoring", "functional"],
      "licenseModel": "proprietary",
      "license": "Commercial service",
      "pricing": "freemium",
      "interfaces": ["web", "cli"],
      "execution": ["cloud"],
      "testCreation": ["manual", "scripted"],
      "ci": true,
      "features": [
        "Scheduled HTTP API checks",
        "Monitoring as code",
        "Alerts and execution history"
      ],
      "notes": "This entry describes the hosted monitoring service. Limits and capabilities vary by plan.",
      "status": "active",
      "sources": [
        "https://www.checklyhq.com/",
        "https://www.checklyhq.com/docs/api-checks/"
      ],
      "lastVerified": "2026-10-27",
      "documentation": "https://www.checklyhq.com/docs/"
    },
    {
      "id": "evomaster",
      "name": "EvoMaster",
      "description": "Automatically generate and execute REST API tests using search-based fuzzing, then export reproducible regression tests.",
      "website": "https://github.com/WebFuzzing/EvoMaster",
      "categories": ["generation", "functional", "security"],
      "licenseModel": "open-source",
      "license": "LGPL-3.0",
      "pricing": "free",
      "interfaces": ["cli"],
      "execution": ["local"],
      "testCreation": ["generated"],
      "ci": true,
      "features": [
        "Black-box and instrumented white-box API fuzzing",
        "Stateful request sequences and fault detection",